{
  "bars_path": "fixtures/etf_daily.csv",
  "bars_sha256": "c0cf2c0daf6256e5afabada832fe77878a8480e7f81e632a63bbdb6078187f32",
  "broker_writes": false,
  "calibration": null,
  "caveats": [
    "Simulated next-open fills on Yahoo Finance adjusted daily bars. Not exchange prints.",
    "Adjustment uses the download-time backward factor recorded in fixtures/SOURCE.json.",
    "Universe is SPY, QQQ, and IWM, chosen because those ETFs existed for the whole window. This is not a survivorship-free stock universe.",
    "Primary lookback is fixed at 20 sessions. Lookbacks 10, 40, and 60 are trials for PBO and DSR only and were not used to pick the reported path.",
    "No numeric threshold in this sidecar is a frozen qualify gate.",
    "The harness submits no broker orders. orders_submitted is 0.",
    "The flat cost is an assumption. Predicted-minus-realized cost is that assumption minus the overnight gap, not a measured live impact.",
    "Trailing mean return is a naive edge input to the sizer, not a validated forecast."
  ],
  "equity_curve": [
    {
      "date": "2021-10-18",
      "equity": "100000.0000000"
    },
    {
      "date": "2021-10-19",
      "equity": "100000.0000000"
    },
    {
      "date": "2021-10-20",
      "equity": "100000.0000000"
    },
    {
      "date": "2021-10-21",
      "equity": "100000.0000000"
    },
    {
      "date": "2021-10-22",
      "equity": "100000.0000000"
    },
    {
      "date": "2021-10-25",
      "equity": "100000.0000000"
    },
    {
      "date": "2021-10-26",
      "equity": "100000.0000000"
    },
    {
      "date": "2021-10-27",
      "equity": "100000.0000000"
    },
    {
      "date": "2021-10-28",
      "equity": "100000.0000000"
    },
    {
      "date": "2021-10-29",
      "equity": "100000.0000000"
    },
    {
      "date": "2021-11-01",
      "equity": "100000.0000000"
    },
    {
      "date": "2021-11-02",
      "equity": "100000.0000000"
    },
    {
      "date": "2021-11-03",
      "equity": "100000.0000000"
    },
    {
      "date": "2021-11-04",
      "equity": "100000.0000000"
    },
    {
      "date": "2021-11-05",
      "equity": "100000.0000000"
    },
    {
      "date": "2021-11-08",
      "equity": "100000.0000000"
    },
    {
      "date": "2021-11-09",
      "equity": "100000.0000000"
    },
    {
      "date": "2021-11-10",
      "equity": "100000.0000000"
    },
    {
      "date": "2021-11-11",
      "equity": "100000.0000000"
    },
    {
      "date": "2021-11-12",
      "equity": "100000.0000000"
    },
    {
      "date": "2021-11-15",
      "equity": "100000.0000000"
    },
    {
      "date": "2021-11-16",
      "equity": "100619.2909477758020299245594"
    },
    {
      "date": "2021-11-17",
      "equity": "100144.1979721214762345505860"
    },
    {
      "date": "2021-11-18",
      "equity": "100490.9591620115760925010902"
    },
    {
      "date": "2021-11-19",
      "equity": "100345.0232388486696280049337"
    },
    {
      "date": "2021-11-22",
      "equity": "99708.02466385426689594268615"
    },
    {
      "date": "2021-11-23",
      "equity": "99543.11117341624109881186855"
    },
    {
      "date": "2021-11-24",
      "equity": "99780.95892795235897193494944"
    },
    {
      "date": "2021-11-26",
      "equity": "97215.61109788455304268907894"
    },
    {
      "date": "2021-11-29",
      "equity": "98363.73497428102769903845826"
    },
    {
      "date": "2021-11-30",
      "equity": "96590.69986228667728479393927"
    },
    {
      "date": "2021-12-01",
      "equity": "95469.65151494806305258642185"
    },
    {
      "date": "2021-12-02",
      "equity": "96118.62672071863014335719488"
    },
    {
      "date": "2021-12-03",
      "equity": "94541.56087399919302796478657"
    },
    {
      "date": "2021-12-06",
      "equity": "95255.65228888517055036729438"
    },
    {
      "date": "2021-12-07",
      "equity": "97960.85299538537603965567501"
    },
    {
      "date": "2021-12-08",
      "equity": "98059.09314670225808732559271"
    },
    {
      "date": "2021-12-09",
      "equity": "97946.25203300644461899696469"
    },
    {
      "date": "2021-12-10",
      "equity": "98028.38845817852062512220038"
    },
    {
      "date": "2021-12-13",
      "equity": "97918.04130177995142058597308"
    },
    {
      "date": "2021-12-14",
      "equity": "97840.12704081109547602903907"
    },
    {
      "date": "2021-12-15",
      "equity": "97834.39172201283918026956671"
    },
    {
      "date": "2021-12-16",
      "equity": "97834.39172201283918026956671"
    },
    {
      "date": "2021-12-17",
      "equity": "97834.39172201283918026956671"
    },
    {
      "date": "2021-12-20",
      "equity": "97834.39172201283918026956671"
    },
    {
      "date": "2021-12-21",
      "equity": "97834.39172201283918026956671"
    },
    {
      "date": "2021-12-22",
      "equity": "97834.39172201283918026956671"
    },
    {
      "date": "2021-12-23",
      "equity": "97834.39172201283918026956671"
    },
    {
      "date": "2021-12-27",
      "equity": "97834.39172201283918026956671"
    },
    {
      "date": "2021-12-28",
      "equity": "97834.39172201283918026956671"
    },
    {
      "date": "2021-12-29",
      "equity": "97834.39172201283918026956671"
    },
    {
      "date": "2021-12-30",
      "equity": "97598.17276156869519728479469"
    },
    {
      "date": "2021-12-31",
      "equity": "97252.14903282809281749146563"
    },
    {
      "date": "2022-01-03",
      "equity": "98118.87783443417664669996826"
    },
    {
      "date": "2022-01-04",
      "equity": "97679.84744281581922742288738"
    },
    {
      "date": "2022-01-05",
      "equity": "95068.86236585795988018644001"
    },
    {
      "date": "2022-01-06",
      "equity": "94943.18152154867829376409455"
    },
    {
      "date": "2022-01-07",
      "equity": "94722.55076885167008258702991"
    },
    {
      "date": "2022-01-10",
      "equity": "94653.38238952170315573184177"
    },
    {
      "date": "2022-01-11",
      "equity": "95159.03508308005050943766893"
    },
    {
      "date": "2022-01-12",
      "equity": "95310.47806697986704190201604"
    },
    {
      "date": "2022-01-13",
      "equity": "93976.92962411772397756059338"
    },
    {
      "date": "2022-01-14",
      "equity": "94070.90436819880179452361748"
    },
    {
      "date": "2022-01-18",
      "equity": "91931.16892964938083344924901"
    },
    {
      "date": "2022-01-19",
      "equity": "90770.48901252868483946614872"
    },
    {
      "date": "2022-01-20",
      "equity": "89519.27677031990470475592503"
    },
    {
      "date": "2022-01-21",
      "equity": "89184.07805140819818382540553"
    },
    {
      "date": "2022-01-24",
      "equity": "89184.07805140819818382540553"
    },
    {
      "date": "2022-01-25",
      "equity": "89184.07805140819818382540553"
    },
    {
      "date": "2022-01-26",
      "equity": "89184.07805140819818382540553"
    },
    {
      "date": "2022-01-27",
      "equity": "89184.07805140819818382540553"
    },
    {
      "date": "2022-01-28",
      "equity": "89184.07805140819818382540553"
    },
    {
      "date": "2022-01-31",
      "equity": "89184.07805140819818382540553"
    },
    {
      "date": "2022-02-01",
      "equity": "89184.07805140819818382540553"
    },
    {
      "date": "2022-02-02",
      "equity": "89184.07805140819818382540553"
    },
    {
      "date": "2022-02-03",
      "equity": "89184.07805140819818382540553"
    },
    {
      "date": "2022-02-04",
      "equity": "89184.07805140819818382540553"
    },
    {
      "date": "2022-02-07",
      "equity": "89184.07805140819818382540553"
    },
    {
      "date": "2022-02-08",
      "equity": "89184.07805140819818382540553"
    },
    {
      "date": "2022-02-09",
      "equity": "89184.07805140819818382540553"
    },
    {
      "date": "2022-02-10",
      "equity": "89184.07805140819818382540553"
    },
    {
      "date": "2022-02-11",
      "equity": "89184.07805140819818382540553"
    },
    {
      "date": "2022-02-14",
      "equity": "89184.07805140819818382540553"
    },
    {
      "date": "2022-02-15",
      "equity": "89184.07805140819818382540553"
    },
    {
      "date": "2022-02-16",
      "equity": "89184.07805140819818382540553"
    },
    {
      "date": "2022-02-17",
      "equity": "89184.07805140819818382540553"
    },
    {
      "date": "2022-02-18",
      "equity": "89039.88732733855937129211908"
    },
    {
      "date": "2022-02-22",
      "equity": "88783.45899522494108502744204"
    },
    {
      "date": "2022-02-23",
      "equity": "88447.64709347015437946590476"
    },
    {
      "date": "2022-02-24",
      "equity": "88909.39233319462251776553566"
    },
    {
      "date": "2022-02-25",
      "equity": "89316.38157535331746388185646"
    },
    {
      "date": "2022-02-28",
      "equity": "90226.46739414653195595899347"
    },
    {
      "date": "2022-03-01",
      "equity": "88738.74779600190871883515220"
    },
    {
      "date": "2022-03-02",
      "equity": "90497.27684854718967815050922"
    },
    {
      "date": "2022-03-03",
      "equity": "89609.15777492748859878108456"
    },
    {
      "date": "2022-03-04",
      "equity": "88498.66870000829489184404768"
    },
    {
      "date": "2022-03-07",
      "equity": "87642.57366649591938505887749"
    },
    {
      "date": "2022-03-08",
      "equity": "87814.66390557990152647608586"
    },
    {
      "date": "2022-03-09",
      "equity": "88697.61505940717878580523985"
    },
    {
      "date": "2022-03-10",
      "equity": "88639.72416581730508642163331"
    },
    {
      "date": "2022-03-11",
      "equity": "88126.67815002331440717875346"
    },
    {
      "date": "2022-03-14",
      "equity": "88205.52695173871512943292121"
    },
    {
      "date": "2022-03-15",
      "equity": "88205.52695173871512943292121"
    },
    {
      "date": "2022-03-16",
      "equity": "88205.52695173871512943292121"